{
 "schema_version": "1.0",
 "rfam_acc": "RF00011",
 "clen": 365,
 "track_name": "reference_structural_elements",
 "track_kind": "categorical_reference_transfer",
 "interpretation": "Element labels of one curated reference chain transferred to Rfam consensus positions through the validated residue mapping. They are not independent observations of helices or loops in each RNA instance.",
 "reference": {
  "pdb_id": "9owq",
  "auth_asym_id": "A",
  "label_asym_id": "A",
  "entity_id": 1,
  "seq_name": "9owq_1_A_A",
  "model": 1,
  "reference_chains_in_file": [
   "9OWQ|1|A"
  ],
  "n_annotated_nucleotides": 378,
  "citation": []
 },
 "source": {
  "name": "BGSU nucleotide annotations (family file)",
  "url": "https://rna.bgsu.edu/data/nucleotide_annotations/RF00011_annotations.txt",
  "retrieved": "2026-10-19",
  "status": "ok",
  "annotation_identifier": "RF00011_annotations.txt"
 },
 "transfer_method": "reference unit id -> (pdb_id, label_asym_id, label_seq_id) by author number + insertion code -> rfam_consensus_pos of the reference chain mapping (rna_explorer mapping pipeline)",
 "elements": [
  {
   "element": "Helix P1",
   "spans": [
    [
     1,
     7
    ],
    [
     362,
     365
    ]
   ],
   "n_positions": 11
  },
  {
   "element": "Helix P2",
   "spans": [
    [
     8,
     14
    ],
    [
     314,
     320
    ]
   ],
   "n_positions": 14
  },
  {
   "element": "Helix P3",
   "spans": [
    [
     15,
     24
    ],
    [
     27,
     35
    ]
   ],
   "n_positions": 19
  },
  {
   "element": "L3",
   "spans": [
    [
     25,
     26
    ]
   ],
   "n_positions": 2
  },
  {
   "element": "Helix P4",
   "spans": [
    [
     41,
     48
    ],
    [
     352,
     358
    ]
   ],
   "n_positions": 15
  },
  {
   "element": "Helix P5",
   "spans": [
    [
     49,
     53
    ],
    [
     231,
     235
    ]
   ],
   "n_positions": 10
  },
  {
   "element": "Helix P6",
   "spans": [
    [
     54,
     59
    ],
    [
     66,
     71
    ]
   ],
   "n_positions": 12
  },
  {
   "element": "L6",
   "spans": [
    [
     60,
     65
    ]
   ],
   "n_positions": 6
  },
  {
   "element": "Helix P7",
   "spans": [
    [
     77,
     81
    ],
    [
     226,
     230
    ]
   ],
   "n_positions": 10
  },
  {
   "element": "Helix P8",
   "spans": [
    [
     82,
     87
    ],
    [
     98,
     103
    ]
   ],
   "n_positions": 12
  },
  {
   "element": "L8",
   "spans": [
    [
     88,
     97
    ]
   ],
   "n_positions": 10
  },
  {
   "element": "Helix P9",
   "spans": [
    [
     104,
     110
    ],
    [
     115,
     122
    ]
   ],
   "n_positions": 15
  },
  {
   "element": "L9",
   "spans": [
    [
     112,
     113
    ]
   ],
   "n_positions": 2
  },
  {
   "element": "Helix P10",
   "spans": [
    [
     123,
     124
    ],
    [
     224,
     225
    ]
   ],
   "n_positions": 4
  },
  {
   "element": "Helix P10.1",
   "spans": [
    [
     126,
     143
    ],
    [
     148,
     165
    ]
   ],
   "n_positions": 36
  },
  {
   "element": "L10.1",
   "spans": [
    [
     144,
     147
    ]
   ],
   "n_positions": 4
  },
  {
   "element": "Helix P11",
   "spans": [
    [
     171,
     175
    ],
    [
     217,
     223
    ]
   ],
   "n_positions": 12
  },
  {
   "element": "IDTM",
   "spans": [
    [
     176,
     187
    ],
    [
     208,
     216
    ]
   ],
   "n_positions": 21
  },
  {
   "element": "Helix P12",
   "spans": [
    [
     188,
     195
    ],
    [
     200,
     207
    ]
   ],
   "n_positions": 16
  },
  {
   "element": "L12",
   "spans": [
    [
     196,
     199
    ]
   ],
   "n_positions": 4
  },
  {
   "element": "Helix P15",
   "spans": [
    [
     239,
     243
    ],
    [
     251,
     255
    ]
   ],
   "n_positions": 10
  },
  {
   "element": "L15",
   "spans": [
    [
     244,
     250
    ]
   ],
   "n_positions": 7
  },
  {
   "element": "Helix P15.1",
   "spans": [
    [
     259,
     270
    ],
    [
     278,
     281
    ],
    [
     283,
     289
    ]
   ],
   "n_positions": 23
  },
  {
   "element": "L15.1",
   "spans": [
    [
     271,
     277
    ]
   ],
   "n_positions": 7
  },
  {
   "element": "Helix P15.2",
   "spans": [
    [
     290,
     295
    ],
    [
     297,
     305
    ]
   ],
   "n_positions": 15
  },
  {
   "element": "L15.2",
   "spans": [
    [
     296,
     296
    ]
   ],
   "n_positions": 1
  },
  {
   "element": "Helix P19",
   "spans": [
    [
     321,
     345
    ]
   ],
   "n_positions": 25
  }
 ],
 "positions": [
  {
   "rfam_consensus_pos": 1,
   "element": "Helix P1",
   "all_labels": [
    "Helix P1"
   ],
   "reference_unit_id": "9OWQ|1|A|A|8",
   "reference_label_seq_id": 8,
   "reference_author_residue_number": 8,
   "reference_nucleotide": "A",
   "reference_pp_char": "*",
   "reference_pp_category": "high",
   "reference_has_coordinates": true
  },
  {
   "rfam_consensus_pos": 2,
   "element": "Helix P1",
   "all_labels": [
    "Helix P1"
   ],
   "reference_unit_id": "9OWQ|1|A|U|9",
   "reference_label_seq_id": 9,
   "reference_author_residue_number": 9,
   "reference_nucleotide": "U",
   "reference_pp_char": "*",
   "reference_pp_category": "high",
   "reference_has_coordinates": true
  },
  {
   "rfam_consensus_pos": 3,
   "element": "Helix P1",
   "all_labels": [
    "Helix P1"
   ],
   "reference_unit_id": "9OWQ|1|A|G|10",
   "reference_label_seq_id": 10,
   "reference_author_residue_number": 10,
   "reference_nucleotide": "G",
   "reference_pp_char": "*",
   "reference_pp_category": "high",
   "reference_has_coordinates": true
  },
  {
   "rfam_consensus_pos": 4,
   "element": "Helix P1",
   "all_labels": [
    "Helix P1"
   ],
   "reference_unit_id": "9OWQ|1|A|C|11",
   "reference_label_seq_id": 11,
   "reference_author_residue_number": 11,
   "reference_nucleotide": "C",
   "reference_pp_char": "*",
   "reference_pp_category": "high",
   "reference_has_coordinates": true
  },
  {
   "rfam_consensus_pos": 5,
   "element": "Helix P1",
   "all_labels": [
    "Helix P1"
   ],
   "reference_unit_id": "9OWQ|1|A|U|12",
   "reference_label_seq_id": 12,
   "reference_author_residue_number": 12,
   "reference_nucleotide": "U",
   "reference_pp_char": "*",
   "reference_pp_category": "high",
   "reference_has_coordinates": true
  },
  {
   "rfam_consensus_pos": 6,
   "element": "Helix P1",
   "all_labels": [
    "Helix P1"
   ],
   "reference_unit_id": "9OWQ|1|A|C|13",
   "reference_label_seq_id": 13,
   "reference_author_residue_number": 13,
   "reference_nucleotide": "C",
   "reference_pp_char": "*",
   "reference_pp_category": "high",
   "reference_has_coordinates": true
  },
  {
   "rfam_consensus_pos": 7,
   "element": "Helix P1",
   "all_labels": [
    "Helix P1"
   ],
   "reference_unit_id": "9OWQ|1|A|G|14",
   "reference_label_seq_id": 14,
   "reference_author_residue_number": 14,
   "reference_nucleotide": "G",
   "reference_pp_char": "*",
   "reference_pp_category": "high",
   "reference_has_coordinates": true
  },
  {
   "rfam_consensus_pos": 8,
   "element": "Helix P2",
   "all_labels": [
    "Helix P2"
   ],
   "reference_unit_id": "9OWQ|1|A|G|15",
   "reference_label_seq_id": 15,
   "reference_author_residue_number": 15,
   "reference_nucleotide": "G",
   "reference_pp_char": "*",
   "reference_pp_category": "high",
   "reference_has_coordinates": true
  },
  {
   "rfam_consensus_pos": 9,
   "element": "Helix P2",
   "all_labels": [
    "Helix P2"
   ],
   "reference_unit_id": "9OWQ|1|A|G|16",
   "reference_label_seq_id": 16,
   "reference_author_residue_number": 16,
   "reference_nucleotide": "G",
   "reference_pp_char": "*",
   "reference_pp_category": "high",
   "reference_has_coordinates": true
  },
  {
   "rfam_consensus_pos": 10,
   "element": "Helix P2",
   "all_labels": [
    "Helix P2"
   ],
   "reference_unit_id": "9OWQ|1|A|U|17",
   "reference_label_seq_id": 17,
   "reference_author_residue_number": 17,
   "reference_nucleotide": "U",
   "reference_pp_char": "*",
   "reference_pp_category": "high",
   "reference_has_coordinates": true
  },
  {
   "rfam_consensus_pos": 11,
   "element": "Helix P2",
   "all_labels": [
    "Helix P2"
   ],
   "reference_unit_id": "9OWQ|1|A|A|18",
   "reference_label_seq_id": 18,
   "reference_author_residue_number": 18,
   "reference_nucleotide": "A",
   "reference_pp_char": "*",
   "reference_pp_category": "high",
   "reference_has_coordinates": true
  },
  {
   "rfam_consensus_pos": 12,
   "element": "Helix P2",
   "all_labels": [
    "Helix P2"
   ],
   "reference_unit_id": "9OWQ|1|A|A|19",
   "reference_label_seq_id": 19,
   "reference_author_residue_number": 19,
   "reference_nucleotide": "A",
   "reference_pp_char": "*",
   "reference_pp_category": "high",
   "reference_has_coordinates": true
  },
  {
   "rfam_consensus_pos": 13,
   "element": "Helix P2",
   "all_labels": [
    "Helix P2"
   ],
   "reference_unit_id": "9OWQ|1|A|U|20",
   "reference_label_seq_id": 20,
   "reference_author_residue_number": 20,
   "reference_nucleotide": "U",
   "reference_pp_char": "*",
   "reference_pp_category": "high",
   "reference_has_coordinates": true
  },
  {
   "rfam_consensus_pos": 14,
   "element": "Helix P2",
   "all_labels": [
    "Helix P2"
   ],
   "reference_unit_id": "9OWQ|1|A|C|21",
   "reference_label_seq_id": 21,
   "reference_author_residue_number": 21,
   "reference_nucleotide": "C",
   "reference_pp_char": "*",
   "reference_pp_category": "high",
   "reference_has_coordinates": true
  },
  {
   "rfam_consensus_pos": 15,
   "element": "Helix P3",
   "all_labels": [
    "Helix P3"
   ],
   "reference_unit_id": "9OWQ|1|A|G|22",
   "reference_label_seq_id": 22,
   "reference_author_residue_number": 22,
   "reference_nucleotide": "G",
   "reference_pp_char": "*",
   "reference_pp_category": "high",
   "reference_has_coordinates": true
  },
  {
   "rfam_consensus_pos": 16,
   "element": "Helix P3",
   "all_labels": [
    "Helix P3"
   ],
   "reference_unit_id": "9OWQ|1|A|C|23",
   "reference_label_seq_id": 23,